results.csv

model,zorro,dialogue_minpairs_words,dialogue_minpairs_tokens,lexical_decision_task
challenge_baseline_simpo,77.7,58.1,57.9,57.2
another_llama,65.5,64.3,63.8,40.3
dpo_naturalistic,64.8,68.4,67.6,40.5
dpo_synthetic,62.7,64.9,64.3,41.3
ppo_bleu,62.5,62,61,40.7
ppo_semsim,64.7,61.1,63.6,39.7
ppo_score,65.2,60.6,62.5,40.2
ppo_confidence,63.7,63.7,62.4,40.8

README.md

## Evaluation with DPO

**BASELINE**: our *bbunzeck/another-llama* baseline model scores **65.5%** (accuracy) on Zorro and **64.3%** on the minimal pairs evaluation set based on words match, and **63.8%** on dialogue minimal pairs based on tokens match. It scores **40.3%** on the lexical decision task. \

**DPO_REAL_PAIRS**: the last checkpoint of our fine-tuned model on real dpo pairs scores **64.8%** on Zorro and **68.4%** on the minimal pairs evaluation set based on words match, and **67.6%** on dialogue minimal pairs based on tokens match. It scores **40.5%** on the lexical decision task. \

**DPO_SYNTHETIC_PAIRS**: the last checkpoint of our fine-tuned model on real dpo pairs scores **62.7%** on Zorro and **64.9%** on the minimal pairs evaluation set based on words match, and **64.3%** on dialogue minimal pairs based on tokens match. It scores **41.3%** on the lexical decision task.\